{
  "id": "xbox-default",
  "name": "Xbox default",
  "schemaVersion": 1,
  "defaultOrientation": "landscape",
  "sections": [
    {
      "id": "left",
      "relativeWidth": 0.86,
      "relativeMinWidth": 0.65,
      "controls": [
        {
          "id": "lt",
          "type": "trigger",
          "geometry": {
            "position": {
              "x": -0.06,
              "y": -0.39
            },
            "size": {
              "width": 0.5,
              "height": 0.115
            }
          },
          "label": "LT",
          "shape": "rect",
          "binding": "leftTrigger"
        },
        {
          "id": "lb",
          "type": "button",
          "geometry": {
            "position": {
              "x": -0.06,
              "y": -0.255
            },
            "size": {
              "width": 0.5,
              "height": 0.09
            }
          },
          "label": "LB",
          "shape": "rect",
          "binding": "leftShoulder"
        },
        {
          "id": "left-stick",
          "type": "joystick",
          "geometry": {
            "position": {
              "x": -0.13,
              "y": 0.11
            },
            "size": {
              "width": 0.336,
              "height": 0.336
            }
          },
          "label": "Left stick",
          "shape": "round",
          "binding": "leftStick"
        },
        {
          "id": "dpad",
          "type": "dpad",
          "geometry": {
            "position": {
              "x": 0.2,
              "y": 0.26
            },
            "size": {
              "width": 0.32,
              "height": 0.32
            }
          },
          "label": "D-pad",
          "bindings": {
            "up": "dpadUp",
            "down": "dpadDown",
            "left": "dpadLeft",
            "right": "dpadRight"
          }
        }
      ]
    },
    {
      "id": "center",
      "relativeWidth": 0.5,
      "relativeMinWidth": 0.38,
      "controls": [
        {
          "id": "back",
          "type": "button",
          "geometry": {
            "position": {
              "x": -0.095,
              "y": 0.08
            },
            "size": {
              "width": 0.14,
              "height": 0.075
            }
          },
          "label": "Back",
          "shape": "round",
          "binding": "back"
        },
        {
          "id": "start",
          "type": "button",
          "geometry": {
            "position": {
              "x": 0.095,
              "y": 0.08
            },
            "size": {
              "width": 0.14,
              "height": 0.075
            }
          },
          "label": "Start",
          "shape": "round",
          "binding": "start"
        }
      ]
    },
    {
      "id": "right",
      "relativeWidth": 0.94,
      "relativeMinWidth": 0.67,
      "controls": [
        {
          "id": "rt",
          "type": "trigger",
          "geometry": {
            "position": {
              "x": 0.05,
              "y": -0.39
            },
            "size": {
              "width": 0.5,
              "height": 0.115
            }
          },
          "label": "RT",
          "shape": "rect",
          "binding": "rightTrigger"
        },
        {
          "id": "rb",
          "type": "button",
          "geometry": {
            "position": {
              "x": 0.05,
              "y": -0.255
            },
            "size": {
              "width": 0.5,
              "height": 0.09
            }
          },
          "label": "RB",
          "shape": "rect",
          "binding": "rightShoulder"
        },
        {
          "id": "right-stick",
          "type": "joystick",
          "geometry": {
            "position": {
              "x": -0.25,
              "y": 0.3
            },
            "size": {
              "width": 0.32,
              "height": 0.32
            }
          },
          "label": "Right stick",
          "shape": "round",
          "binding": "rightStick"
        },
        {
          "id": "xyab-fill-n",
          "type": "hitfill",
          "geometry": {
            "position": {
              "x": 0.11499690933137954,
              "y": 0.007969442363635544
            },
            "size": {
              "width": 0.07806137466617856,
              "height": 0.1367681964150509
            }
          },
          "label": "",
          "shape": "round",
          "parentId": "north"
        },
        {
          "id": "xyab-fill-s",
          "type": "hitfill",
          "geometry": {
            "position": {
              "x": 0.11382557793824537,
              "y": 0.161304842727782
            },
            "size": {
              "width": 0.0727110104130383,
              "height": 0.11879963708150106
            }
          },
          "label": "",
          "shape": "round",
          "parentId": "south"
        },
        {
          "id": "xyab-fill-w",
          "type": "hitfill",
          "geometry": {
            "position": {
              "x": 0.03723540573312498,
              "y": 0.09073398581645722
            },
            "size": {
              "width": 0.1381808034202272,
              "height": 0.07571934259776489
            }
          },
          "label": "",
          "shape": "round",
          "parentId": "west"
        },
        {
          "id": "xyab-fill-e",
          "type": "hitfill",
          "geometry": {
            "position": {
              "x": 0.18783252873772077,
              "y": 0.09190503689054488
            },
            "size": {
              "width": 0.1418549451629352,
              "height": 0.06653384808147138
            }
          },
          "label": "",
          "shape": "round",
          "parentId": "east"
        },
        {
          "id": "north",
          "type": "button",
          "geometry": {
            "position": {
              "x": 0.1175,
              "y": -0.06
            },
            "size": {
              "width": 0.22,
              "height": 0.22
            }
          },
          "label": "Y",
          "shape": "round",
          "binding": "north"
        },
        {
          "id": "west",
          "type": "button",
          "geometry": {
            "position": {
              "x": -0.03,
              "y": 0.1
            },
            "size": {
              "width": 0.22,
              "height": 0.22
            }
          },
          "label": "X",
          "shape": "round",
          "binding": "west"
        },
        {
          "id": "east",
          "type": "button",
          "geometry": {
            "position": {
              "x": 0.265,
              "y": 0.1
            },
            "size": {
              "width": 0.22,
              "height": 0.22
            }
          },
          "label": "B",
          "shape": "round",
          "binding": "east"
        },
        {
          "id": "south",
          "type": "button",
          "geometry": {
            "position": {
              "x": 0.1175,
              "y": 0.26
            },
            "size": {
              "width": 0.22,
              "height": 0.22
            }
          },
          "label": "A",
          "shape": "round",
          "binding": "south"
        }
      ]
    }
  ],
  "assets": []
}
