{
  "id": "xbox-default",
  "name": "Xbox default",
  "schemaVersion": 1,
  "defaultOrientation": "landscape",
  "sections": [
    {"id":"main","rect":{"x":0,"y":0,"width":1,"height":1},"controls":[
      {"id":"lt","type":"trigger","rect":{"x":0.047,"y":0.092,"width":0.469,"height":0.088},"label":"LT","visible":true,"binding":"leftTrigger","shape":"rect"},
      {"id":"lb","type":"button","rect":{"x":0.047,"y":0.208,"width":0.469,"height":0.088},"label":"LB","visible":true,"binding":"leftShoulder","shape":"rect"},
      {"id":"rt","type":"trigger","rect":{"x":0.719,"y":0.092,"width":0.469,"height":0.088},"label":"RT","visible":true,"binding":"rightTrigger","shape":"rect"},
      {"id":"rb","type":"button","rect":{"x":0.719,"y":0.208,"width":0.469,"height":0.088},"label":"RB","visible":true,"binding":"rightShoulder","shape":"rect"},
      {"id":"left-stick","type":"joystick","rect":{"x":0.036,"y":0.369,"width":0.375,"height":0.375},"label":"Left stick","visible":true,"binding":"leftStick"},
      {"id":"dpad","type":"dpad","rect":{"x":0.276,"y":0.592,"width":0.271,"height":0.271},"label":"D-pad","visible":true,"bindings":{"up":"dpadUp","down":"dpadDown","left":"dpadLeft","right":"dpadRight"}},
      {"id":"back","type":"button","rect":{"x":0.388,"y":0.348,"width":0.15,"height":0.067},"label":"Back","visible":true,"binding":"back","shape":"pill"},
      {"id":"start","type":"button","rect":{"x":0.471,"y":0.348,"width":0.15,"height":0.067},"label":"Start","visible":true,"binding":"start","shape":"pill"},
      {"id":"right-stick","type":"joystick","rect":{"x":0.573,"y":0.369,"width":0.365,"height":0.365},"label":"Right stick","visible":true,"binding":"rightStick"},
      {"id":"north","type":"button","rect":{"x":0.839,"y":0.335,"width":0.146,"height":0.146},"label":"Y","visible":true,"binding":"north","shape":"circle"},
      {"id":"west","type":"button","rect":{"x":0.766,"y":0.473,"width":0.146,"height":0.146},"label":"X","visible":true,"binding":"west","shape":"circle"},
      {"id":"east","type":"button","rect":{"x":0.911,"y":0.473,"width":0.146,"height":0.146},"label":"B","visible":true,"binding":"east","shape":"circle"},
      {"id":"south","type":"button","rect":{"x":0.839,"y":0.635,"width":0.146,"height":0.146},"label":"A","visible":true,"binding":"south","shape":"circle"},
      {"id":"guide","type":"button","rect":{"x":0.44,"y":0.02,"width":0.12,"height":0.05},"label":"Guide","visible":false,"binding":"guide","shape":"circle"},
      {"id":"ls-click","type":"button","rect":{"x":0.03,"y":0.9,"width":0.12,"height":0.08},"label":"L3","visible":false,"binding":"leftStick","shape":"circle"},
      {"id":"rs-click","type":"button","rect":{"x":0.17,"y":0.9,"width":0.12,"height":0.08},"label":"R3","visible":false,"binding":"rightStick","shape":"circle"}
    ]}
  ],
  "assets": []
}
